{"assessment_id":"HIT-EXAMPLE","schema_version":"0.4.0-candidate","specification_version":"0.4.0-candidate","predecessor_schema_version":"0.1.0","migration_status":"native_candidate","institutional_unit":"Example Institution","decision_process":"AI assisted example decision","assessment_scope":"period_level","period":{"start":"2026-01-01","end":"2026-01-31"},"follow_up_period":null,"ai_system_role":"The AI system recommends a decision.","sampling":{"population_or_record_universe":"All decisions in the month.","selection_rule":"Review all available records.","known_exclusions":[],"selection_effects":[]},"aggregation":{"mode":"dominant_pattern","predeclared":true,"rationale":"The assessment evaluates the dominant process pattern.","other_rule":null},"actors":[{"actor_id":"ACT-1","institutional_identity":"Example Institution","role_type":"human","role_name":"Reviewer","authority_types":["direct"],"mechanisms_controlled":["review"],"decision_stages":["authorization"],"relationship":"assessed_actor","related_actor_ids":[],"evidence_claim_ids":["EC-1"],"notes":null}],"assessor":{"name":"Assessor","organization":null,"assessment_date":"2026-02-01","conflict_disclosure":"None"},"evidence_claims":[{"claim_id":"EC-1","artifact_id":"ART-1","artifact_type":"review record","source_id":"S1","locator":{"locator_type":"page","value":"1","reproducibility_note":null},"proposition":"The reviewer was assigned to the process.","relation":"supports","dimensions":["counsel"],"actor_ids":["ACT-1"],"event_date":"2026-01-01","provenance_status":"verified","independence_status":"independent","transformation_history":[],"notes":null}],"substantive_findings":[{"dimension":"counsel","evidence_state":"formal_presence","finding":1,"repair_trigger":"not_applicable","supporting_claim_ids":["EC-1"],"contradicting_claim_ids":[],"limiting_claim_ids":[],"requested_missing_artifacts":["operation log"],"unresolved_proposition":null,"search_or_request_summary":null,"aggregation_basis":"dominant_pattern","rationale":"The formal process existed but substantive operational effect is not established in the bounded record."},{"dimension":"judgment","evidence_state":"formal_presence","finding":1,"repair_trigger":"not_applicable","supporting_claim_ids":["EC-1"],"contradicting_claim_ids":[],"limiting_claim_ids":[],"requested_missing_artifacts":["operation log"],"unresolved_proposition":null,"search_or_request_summary":null,"aggregation_basis":"dominant_pattern","rationale":"The formal process existed but substantive operational effect is not established in the bounded record."},{"dimension":"command","evidence_state":"formal_presence","finding":1,"repair_trigger":"not_applicable","supporting_claim_ids":["EC-1"],"contradicting_claim_ids":[],"limiting_claim_ids":[],"requested_missing_artifacts":["operation log"],"unresolved_proposition":null,"search_or_request_summary":null,"aggregation_basis":"dominant_pattern","rationale":"The formal process existed but substantive operational effect is not established in the bounded record."},{"dimension":"correction","evidence_state":"formal_presence","finding":1,"repair_trigger":"not_applicable","supporting_claim_ids":["EC-1"],"contradicting_claim_ids":[],"limiting_claim_ids":[],"requested_missing_artifacts":["operation log"],"unresolved_proposition":null,"search_or_request_summary":null,"aggregation_basis":"dominant_pattern","rationale":"The formal process existed but substantive operational effect is not established in the bounded record."},{"dimension":"repair","evidence_state":"indeterminate","finding":"IE","repair_trigger":"indeterminate","supporting_claim_ids":["EC-1"],"contradicting_claim_ids":[],"limiting_claim_ids":[],"requested_missing_artifacts":["operation log"],"unresolved_proposition":"Qualifying harm cannot be determined.","search_or_request_summary":"Requested harm determination records.","aggregation_basis":"dominant_pattern","rationale":"The formal process existed but substantive operational effect is not established in the bounded record."},{"dimension":"reform","evidence_state":"formal_presence","finding":1,"repair_trigger":"not_applicable","supporting_claim_ids":["EC-1"],"contradicting_claim_ids":[],"limiting_claim_ids":[],"requested_missing_artifacts":["operation log"],"unresolved_proposition":null,"search_or_request_summary":null,"aggregation_basis":"dominant_pattern","rationale":"The formal process existed but substantive operational effect is not established in the bounded record."}],"telemetry_integrity":{"institutional_record_integrity":{"status":"adequate","provenance":"Traceable provenance record.","scope_and_completeness":"Defined scope and completeness.","edit_authority":"Controlled edit authority.","independence":"Independent evidence basis.","tamper_evidence":"Tamper evidence documented.","retention":"Retention is documented.","contradictions":"No material contradictions.","affected_dimensions":[],"evidence_claim_ids":["EC-1"],"unresolved_proposition":null,"rationale":"This component status is supported by the listed controls and evidence."},"assessment_packet_integrity":{"status":"adequate","provenance":"Traceable provenance record.","scope_and_completeness":"Defined scope and completeness.","edit_authority":"Controlled edit authority.","independence":"Independent evidence basis.","tamper_evidence":"Tamper evidence documented.","retention":"Retention is documented.","contradictions":"No material contradictions.","affected_dimensions":[],"evidence_claim_ids":["EC-1"],"unresolved_proposition":null,"rationale":"This component status is supported by the listed controls and evidence."},"overall_status":"adequate","derivation_rule":"unreliable>IE>limited>adequate"},"summary":null,"most_consequential_missing_artifact":"Operational logs","limitations":["Synthetic candidate fixture."],"migration_notes":null}
